{
  "protocol_version": "telephone-line-codex-app-server-lead-intent-v1",
  "run_id": "telephone-aaaaaaaa-bbbb-cccc-dddd-eeeeeeeeeee1",
  "thread_id": "01a02378-2617-7131-ba20-8e6d5ac625ca",
  "worktree": "C:\\example\\worktree",
  "callback": {
    "path": "C:\\example\\wake-prompt.md",
    "bytes": 12,
    "sha256": "bbbbbbbbbbbbbbbbbbbbbbbbbbbbbbbbbbbbbbbbbbbbbbbbbbbbbbbbbbbbbbbb"
  },
  "wake_marker": "tl-wake:telephone-aaaaaaaa-bbbb-cccc-dddd-eeeeeeeeeee1",
  "profile_fingerprint": "aaaaaaaaaaaaaaaaaaaaaaaaaaaaaaaaaaaaaaaaaaaaaaaaaaaaaaaaaaaaaaaa",
  "codex_version": "codex-cli 0.147.0",
  "executable_sha256": "cccccccccccccccccccccccccccccccccccccccccccccccccccccccccccccccc",
  "profile_sha256": "dddddddddddddddddddddddddddddddddddddddddddddddddddddddddddddddd",
  "codex_command": "C:\\example\\codex.cmd",
  "service_tier": "default",
  "baseline_turn_ids": ["turn-1"],
  "created_at_utc": "2026-08-21T00:00:00.0000000+00:00"
}
